{
  "created_at": "2026-01-17T08:00:04Z",
  "decision_hash": "sha256:25465c6a141649f1a363d8d041cd59dd3cbfed261ef09c49faed8ac25db721ca",
  "intents": [
    {
      "confidence": 0.95,
      "evidence": [
        {
          "end": 21,
          "snippet_redacted": "beschwerde",
          "snippet_sha256": "sha256:43f051aca7290e35e4b025e84ebe1f6cd6ae4cc21cb393564d0802aafed3fb7a",
          "source": "BODY_C14N",
          "start": 11
        }
      ],
      "label": "INTENT_COMPLAINT"
    }
  ],
  "message_id": "665506c4-f415-53b2-bfd9-4a70f9534900",
  "model_info": null,
  "primary_intent": {
    "confidence": 0.95,
    "evidence": [
      {
        "end": 21,
        "snippet_redacted": "beschwerde",
        "snippet_sha256": "sha256:43f051aca7290e35e4b025e84ebe1f6cd6ae4cc21cb393564d0802aafed3fb7a",
        "source": "BODY_C14N",
        "start": 11
      }
    ],
    "label": "INTENT_COMPLAINT"
  },
  "product_line": {
    "confidence": 0.4,
    "evidence": [
      {
        "end": 20,
        "snippet_redacted": "ich erhebe beschwerd",
        "snippet_sha256": "sha256:669f303c4a62373f00c9fe955b49b5f2a9c4264556392cb6f8b4cf5a983dae0d",
        "source": "BODY_C14N",
        "start": 0
      }
    ],
    "label": "PROD_UNKNOWN"
  },
  "risk_flags": [
    {
      "confidence": 0.8,
      "evidence": [
        {
          "end": 112,
          "snippet_redacted": "ombudsmann",
          "snippet_sha256": "sha256:5a31a58de522b6db9fa6a3efa781f7e177ee741e83afea1677f7350e014896a2",
          "source": "BODY_C14N",
          "start": 102
        }
      ],
      "label": "RISK_REGULATORY"
    }
  ],
  "run_id": "0ea43aa6-c5bf-5746-9ef0-46404e99ee5d",
  "schema_id": "urn:ieim:schema:classification-result:1.0.0",
  "schema_version": "1.0.0",
  "urgency": {
    "confidence": 0.75,
    "evidence": [
      {
        "end": 65,
        "snippet_redacted": "sofort",
        "snippet_sha256": "sha256:2ae3016e365168bb9c0c1b5809f609638c85c77d44dc29eefc0002d16a6d1601",
        "source": "BODY_C14N",
        "start": 59
      }
    ],
    "label": "URG_HIGH"
  }
}
